{
  "$schema": "https://json-schema.org/draft/2020-12/schema",
  "title": "Memory Bank Task Record",
  "type": "object",
  "additionalProperties": false,
  "required": [
    "id",
    "title",
    "status",
    "wave",
    "feature",
    "reqs",
    "depends_on",
    "touched_files",
    "tier",
    "gates",
    "verify",
    "docs",
    "evidence_required",
    "source_artifacts",
    "normative_inputs",
    "constraints",
    "invariants",
    "verification_targets"
  ],
  "properties": {
    "id": {
      "type": "string",
      "pattern": "^TASK-[0-9]{3}-T[0-3]-FT-[0-9]{3}-W[0-9]+$"
    },
    "title": {
      "type": "string"
    },
    "status": {
      "type": "string",
      "enum": [
        "planned",
        "ready",
        "in_progress",
        "blocked",
        "done",
        "failed"
      ]
    },
    "wave": {
      "type": "string",
      "pattern": "^W[0-9]+$"
    },
    "feature": {
      "type": "string",
      "pattern": "^FT-[0-9]{3}$"
    },
    "reqs": {
      "type": "array",
      "items": {
        "type": "string",
        "pattern": "^REQ-[0-9]{3}$"
      }
    },
    "depends_on": {
      "type": "array",
      "items": {
        "type": "string",
        "pattern": "^TASK-[0-9]{3}-T[0-3]-FT-[0-9]{3}-W[0-9]+$"
      }
    },
    "touched_files": {
      "type": "array",
      "items": {
        "type": "string"
      }
    },
    "tier": {
      "type": "string",
      "enum": [
        "T0",
        "T1",
        "T2",
        "T3"
      ]
    },
    "gates": {
      "type": "array",
      "items": {
        "type": "object",
        "required": [
          "name",
          "command",
          "required"
        ],
        "additionalProperties": false,
        "properties": {
          "name": {
            "type": "string"
          },
          "command": {
            "type": "string"
          },
          "required": {
            "type": "boolean"
          }
        }
      }
    },
    "verify": {
      "type": "array",
      "items": {
        "anyOf": [
          {
            "type": "string"
          },
          {
            "type": "object",
            "additionalProperties": true
          }
        ]
      }
    },
    "docs": {
      "type": "array",
      "items": {
        "type": "string"
      }
    },
    "evidence_required": {
      "type": "array",
      "items": {
        "type": "string"
      }
    },
    "source_artifacts": {
      "type": "array",
      "items": {
        "type": "string"
      }
    },
    "normative_inputs": {
      "type": "array",
      "items": {
        "type": "string"
      }
    },
    "constraints": {
      "type": "array",
      "items": {
        "type": "string"
      }
    },
    "invariants": {
      "type": "array",
      "items": {
        "type": "string"
      }
    },
    "verification_targets": {
      "type": "array",
      "items": {
        "type": "string"
      }
    },
    "purpose": {
      "type": "string"
    },
    "success_outcome": {
      "type": "string"
    },
    "anti_goals": {
      "type": "array",
      "items": {
        "type": "string"
      }
    },
    "runtime_context": {
      "type": "object",
      "additionalProperties": false,
      "properties": {
        "packet_required": {
          "type": "boolean"
        },
        "packet_ref": {
          "type": "string",
          "pattern": "^\\.memory-bank/packets/TASK-[0-9]{3}-T[0-3]-FT-[0-9]{3}-W[0-9]+\\.packet\\.json$"
        },
        "allowed_write_scope": {
          "type": "array",
          "items": {
            "type": "string"
          }
        },
        "forbidden_scope": {
          "type": "array",
          "items": {
            "type": "string"
          }
        },
        "stop_conditions": {
          "type": "array",
          "items": {
            "type": "string"
          }
        }
      }
    }
  }
}
