{
  "id": "TASK-070",
  "title": "Implement PhysicalActionProposal schema and taxonomy classifier",
  "status": "planned",
  "wave": "W1",
  "feature": "FT-012",
  "reqs": [
    "REQ-016"
  ],
  "depends_on": [
    "TASK-002",
    "TASK-003",
    "TASK-004",
    "TASK-008",
    "TASK-012",
    "TASK-043",
    "TASK-047",
    "TASK-052",
    "TASK-067"
  ],
  "touched_files": [
    "backend/app/safety/*",
    "backend/app/agent_harness/*",
    "backend/app/advisory/*",
    "backend/app/privacy/*",
    "backend/app/db/migrations/*",
    "backend/tests/safety/*",
    "backend/tests/agent_harness/*",
    ".memory-bank/changelog.md"
  ],
  "tier": "T3",
  "gates": [
    {
      "name": "safety schema and classifier tests",
      "command": "pytest backend/tests/safety backend/tests/agent_harness",
      "required": true
    },
    {
      "name": "memory bank validation",
      "command": "node scripts/mb-lint.mjs && node scripts/mb-doctor.mjs",
      "required": true
    }
  ],
  "verify": [
    "PhysicalActionProposal strict schemas reject unknown properties and unsafe raw/provider/UI authority sources.",
    "Classifier covers pH/EC, solution, nutrient dosing, device/environment, manual intervention, and unknown physical intervention categories.",
    "Proposal creation does not create Approval, action_task, or device command records."
  ],
  "docs": [
    ".memory-bank/tasks/plans/IMPL-FT-012.md",
    ".memory-bank/changelog.md"
  ],
  "evidence_required": [
    "unit test output for proposal schema validation and taxonomy classifier",
    "negative tests for raw model output, UI Feed, raw chat, governance, and AgentMemoryRecord authority bypass",
    "redaction evidence for candidate wording persistence/display",
    "HUMAN_CHECKPOINT: done",
    "ROLLBACK_RECOVERY_NOTE: present"
  ],
  "source_artifacts": [
    ".memory-bank/features/FT-012-safety-gate-for-physical-action-advice.md",
    ".memory-bank/tech-specs/FT-012-safety-gate-for-physical-action-advice.md",
    ".memory-bank/requirements.md",
    ".memory-bank/contracts/safety-gate.md",
    ".memory-bank/contracts/agent-harness.md"
  ],
  "normative_inputs": [
    ".memory-bank/constitution.md",
    ".memory-bank/invariants.md",
    ".memory-bank/contracts/api-guidelines.md",
    ".memory-bank/contracts/message-envelope.md",
    ".memory-bank/tech-specs/FT-001-local-accounts-sessions-and-actor-context.md",
    ".memory-bank/tech-specs/FT-002-farm-plant-lifecycle-and-plant-access-grant.md",
    ".memory-bank/tech-specs/FT-007-shared-agent-harness-and-agent-profile-runtime.md",
    ".memory-bank/tech-specs/FT-009-message-envelope-agent-chat-bus-and-ui-feed-isolation.md",
    ".memory-bank/tech-specs/FT-011-plant-state-trust-and-hydroponics-advisor.md",
    ".memory-bank/tech-specs/FT-017-local-privacy-deployment-controls-and-secret-redaction.md",
    "agents-best-practices"
  ],
  "constraints": [
    "PhysicalActionProposal is a typed proposal, not approval or execution.",
    "Strict schemas reject unknown properties for safety-sensitive proposals.",
    "Raw provider output, hidden reasoning, UI Feed, raw chat, unapproved governance content, and AgentMemoryRecord cannot become proposal authority.",
    "No automated actuation tool, command, or side effect may be introduced."
  ],
  "invariants": [
    "The model proposes and the harness/backend validates, authorizes, records, and returns structured observations.",
    "Physical-action advice must pass Safety Gate and authorized human approval before cleared action wording or action_task.",
    "Fresh data is never sufficient by itself for physical action."
  ],
  "verification_targets": [
    "test:safety-gate.fail-closed-approval-boundary",
    "physical-action taxonomy coverage",
    "no Approval/action_task/device command on proposal creation",
    "no raw/UI/governance/memory authority bypass"
  ]
}
