{
  "id": "TASK-004-FT-000-W-0",
  "title": "Run final Foundation gate",
  "status": "planned",
  "wave": "W0",
  "feature": "FT-000",
  "reqs": [
    "REQ-000"
  ],
  "depends_on": [
    "TASK-000-FT-000-W-0",
    "TASK-001-FT-000-W-0",
    "TASK-002-FT-000-W-0",
    "TASK-003-FT-000-W-0"
  ],
  "touched_files": [
    ".tasks/TASK-004-FT-000-W-0/",
    ".protocols/TASK-004-FT-000-W-0/",
    ".memory-bank/foundation.md",
    ".memory-bank/changelog.md"
  ],
  "tier": "T2",
  "gates": [
    {
      "name": "install",
      "command": "python -m pip install -e \".[test]\"",
      "required": true
    },
    {
      "name": "tests",
      "command": "python -m pytest tests",
      "required": true
    },
    {
      "name": "mb-lint",
      "command": "node scripts/mb-lint.mjs",
      "required": true
    },
    {
      "name": "mb-doctor",
      "command": "node scripts/mb-doctor.mjs",
      "required": true
    },
    {
      "name": "diff-check",
      "command": "git diff --check",
      "required": true
    }
  ],
  "verify": [
    "Final gate verifies build/start/bootstrap/db/migration/test/Memory Bank checks from .memory-bank/foundation.md.",
    "Final gate evidence links all prerequisite FT-000 task evidence.",
    "Product tasking remains blocked until this task is done."
  ],
  "docs": [
    ".memory-bank/foundation.md",
    ".memory-bank/features/FT-000-foundation.md",
    ".memory-bank/tasks/plans/IMPL-FT-000.md",
    ".memory-bank/testing/index.md"
  ],
  "evidence_required": [
    "install command output",
    "Windows bootstrap transcript or equivalent operator evidence",
    "DB init transcript or safe local dry-run evidence",
    "migration command output",
    "app start plus /health and /ready evidence",
    "python -m pytest tests output",
    "node scripts/mb-lint.mjs output",
    "node scripts/mb-doctor.mjs output",
    "git diff --check output",
    "links to TASK-000..TASK-003 evidence"
  ],
  "source_artifacts": [
    ".memory-bank/foundation.md",
    ".memory-bank/features/FT-000-foundation.md",
    ".memory-bank/testing/index.md"
  ],
  "normative_inputs": [
    ".memory-bank/architecture/system-architecture.md",
    ".memory-bank/workflows/tier-policy.md",
    ".memory-bank/workflows/mb-sync.md",
    ".memory-bank/spec-backbone.md"
  ],
  "constraints": [
    "Do not implement new product behavior in the final gate.",
    "Do not close product features from FT-000 evidence.",
    "Record only reproducible safe evidence; redact secrets."
  ],
  "invariants": [
    "Foundation gate must be done before product task generation/execution.",
    "FT-000 is not a product feature.",
    "Secrets/auth material must not enter evidence artifacts."
  ],
  "verification_targets": [
    "python -m pip install -e \".[test]\"",
    "powershell -ExecutionPolicy Bypass -File scripts/bootstrap-local.ps1",
    "powershell -ExecutionPolicy Bypass -File scripts/db-init-local.ps1",
    "powershell -ExecutionPolicy Bypass -File scripts/db-migrate-local.ps1",
    "python -m uvicorn backend.app.main:app --host 127.0.0.1 --port 8000",
    "/health",
    "/ready",
    "python -m pytest tests",
    "node scripts/mb-lint.mjs",
    "node scripts/mb-doctor.mjs",
    "git diff --check"
  ],
  "purpose": "Provide one explicit closure gate for the compact Foundation Dev Path before product features are decomposed.",
  "success_outcome": "Foundation exit criteria are evidenced and product tasking may proceed with dependency on this gate.",
  "anti_goals": [
    "No implementation beyond evidence and safe documentation sync.",
    "No product feature closure."
  ],
  "runtime_context": {
    "packet_required": true,
    "packet_ref": ".memory-bank/packets/TASK-004-FT-000-W-0.packet.json",
    "allowed_write_scope": [
      ".tasks/TASK-004-FT-000-W-0/",
      ".protocols/TASK-004-FT-000-W-0/",
      ".memory-bank/foundation.md",
      ".memory-bank/changelog.md",
      ".memory-bank/tasks/TASK-004-FT-000-W-0.task.json"
    ],
    "forbidden_scope": [
      "new product feature behavior",
      "new product task generation",
      "closure of FT-001..FT-016 product features"
    ],
    "stop_conditions": [
      "Any required Foundation prerequisite task is not done.",
      "Any required gate fails.",
      "Evidence contains unredacted secrets or auth material.",
      "Foundation exit criteria cannot be proven reproducibly."
    ]
  }
}
